,Date,User,Tweet
346,2023-03-08 05:00:15+00:00,LakersReporter,"Memphis has attempted 27 free throws to LAL's 20, helping them to an 89-85 lead early in the 4th despite an Austin Reaves layup."
347,2023-03-08 04:01:01+00:00,LakersReporter,"Great energy from LAL on the defensive end with AD back on the floor, as Schröder and Reaves notched B2B steals, both resulting in transition hoops, to tie the score at 54."
348,2023-03-08 03:56:40+00:00,LakersReporter,"Davis is back on the court and should be checking in with 2:37 to play.

They were up 3 when Davis went out after the hit to his face; they're now down 6 as Memphis has repeatedly taken the ball into LAL's paint in his absence."
349,2023-03-08 03:50:58+00:00,LakersReporter,"Lakers are still awaiting Davis getting patched up in the back. He'd dominated the Grizzlies on both ends (13 points, 10 boards in 12 minutes), but has been out for 3 minutes and counting after getting hit in the face."
350,2023-03-08 03:46:05+00:00,LakersReporter,"Unfortunate for both Davis and the Lakers, as blood drawn on a foul by Roddy causes AD to have to go to the locker room after they couldn't fully stop the bleeding during the time out. 

LAL up 34-31 midway through the 2nd Q."
351,2023-03-08 03:26:27+00:00,LakersReporter,"Another spectacular start from Anthony Davis has LAL up 23-16 after his first 3-pointer. 

He has 13 points, 9 boards, an assist and a block."
352,2023-03-08 02:12:01+00:00,LakersReporter,D'Angelo Russell is out tonight. It'll be the 6th straight game he misses with his ankle injury.
353,2023-03-08 01:25:34+00:00,LakersReporter,"Darvin Ham gave his respect and love to Pau Gasol, whom he played against and coached, and cited how much he enjoyed Pau on and off the floor. 

He recalled his favorite Pau game as Game 7 against Denver in Round 1 of the 2012 playoffs, when he dominated with 23P, 17R, 6A + 4B."
354,2023-03-08 01:08:28+00:00,LakersReporter,"Pau talked about how much he treasured his relationship w/Kobe off the court, as it wasn’t common for Kobe to open himself up that way, adding how meaningful it is to him that the bond has continued between Pau, his family and Vanessa Bryant and her girls."
355,2023-03-08 00:55:48+00:00,LakersReporter,"Pau Gasol on his day: “It’s something very special.”

He described many feelings, including pride and honor thinking about his career. There’s also the mix of appreciation, sadness and sense of loss regarding his brotherhood with Kobe, as his No. 16 will go up next to 8 and 24."
356,2023-03-07 22:18:13+00:00,LakersReporter,"Deep dive into the standings, and a look at the most-likely outcomes in the play-in and playoff chase: 👇🏻"
357,2023-03-06 18:21:52+00:00,LakersReporter,Full breakdown of an important Lakers win over Golden State:
358,2023-03-05 23:45:11+00:00,LakersReporter,"“I don’t think he gets the credit he deserves,” said Austin Reaves about Troy Brown, Jr., who joined us for the walkoff after playing a team-high 41 minutes towards 14 points with 8 boards:"
359,2023-03-05 23:04:12+00:00,LakersReporter,"LAL up 109-101 after a tough bucket from AD through Draymond, a stop, and 2 Schröder free throws, with 29 seconds to play. 

Fantastic game from @AntDavis23 on both ends: 39 points, 8 boards, 6 assists, 2 blocks."
360,2023-03-05 22:58:26+00:00,LakersReporter,"LAL were up 8 after a Davis bucket, and got the ball with a steal, but then missed a pair of jumpers with GSW getting B2B 3's from Curry, then Klay, to trim the margin to 2 with 1:45 to play."
361,2023-03-05 22:55:49+00:00,LakersReporter,"Dennis Schröder loves to walk the dog, and just killed about 10 seconds of clock doing so, before driving and finding Davis for a short floater that put LAL up 8."
362,2023-03-05 22:31:22+00:00,LakersReporter,"A key stretch from Austin Reaves helped the Lakers take a 78-72 lead out of the 3rd. He hit a pair of 3's, notched a steal, and tallied his 5th assist in 17 minutes in the final 4 minutes of the 3rd Q.

His 12 points come on 4 of 6 FG's with 3 made triples in 17 minutes."
363,2023-03-05 22:10:48+00:00,LakersReporter,"Vanderbilt has 4 boards (2 offensive) and 4 points in the first 3 minutes of the 3rd Q, plus a Beasley 3, to spark LAL to a 62-57 edge into a GSW time out."
364,2023-03-05 21:49:16+00:00,LakersReporter,"It was a tough 2nd Q for the Lakers after the took a 15-point led out of the 1st Q, as GSW outscored them 36-22 to trim the halftime margin to just one."
365,2023-03-05 21:35:28+00:00,LakersReporter,Mo Bamba is out for the rest of the game with a left ankle injury.
366,2023-03-05 21:23:00+00:00,LakersReporter,"Walker IV and Gabriel both had shots near the basket rim out, as LAL's second unit continues to struggle to score."
367,2023-03-05 21:21:11+00:00,LakersReporter,Draymond's back in for GSW.
368,2023-03-05 21:19:11+00:00,LakersReporter,"LAL take a 33-18 lead out of the 1st Q, as neither team managed to score in the final two minutes of the period.

Davis led LAL with 15 points in his 10 minutes.

Meanwhile, Draymond Green is questionable to return for GSW with a left hand injury."
369,2023-03-05 21:17:41+00:00,LakersReporter,"Mo Bamba had to leave the game, as Wenyen Gabriel checks in. Appeared to tweak an ankle, but we'll get an update shortly."
370,2023-03-05 20:55:28+00:00,LakersReporter,"Good start for the Lakers, who take a 17-7 lead after Davis hit a short jumper.

LAL are 7 of 10 from the field, and have held GSW to 2 of 8, with Klay Thompson making their two FG's."
371,2023-03-05 18:53:01+00:00,LakersReporter,"The Lakers have had success against the Warriors in the last two games, but Stephen Curry didn’t play in either matchup. Darvin Ham said one key, with Steph returning today, is to stay disciplined and “Try not to give him freebies.”"
372,2023-03-04 05:54:48+00:00,LakersReporter,"The Lakers got within as few as 3 points in a 4th Q they trailed by as many as 14, but Minnesota got 5 straight points from Mike Conley to pull away, and win 110-102 despite 38 points from Davis."
373,2023-03-04 05:40:00+00:00,LakersReporter,It's a 10-1 LAL run. Deficit down to 4.
374,2023-03-04 05:35:31+00:00,LakersReporter,"B2B 3's from Davis (33 points), and then Beasley (15) give the Lakers some life here, with 6:52 to play, trimming Minnesota's lead to 97-90."
375,2023-03-04 04:44:43+00:00,LakersReporter,"LAL trail 56-55 at the half, but hung in very well after Anthony Davis picked up his 3rd PF and sat at the 4:36 mark.

LAL trailed by 7 at that time, but trimmed 6 off the lead despite AD being on the bench."
376,2023-03-04 04:14:54+00:00,LakersReporter,Six straight points from Rui Hachimura for the Lakers to start the 2nd Q.
377,2023-03-04 04:07:29+00:00,LakersReporter,"LAL got a late triple from Lonnie Walker IV, their 4th of the quarter, enough for a 34-33 lead after 1.

@AntDavis23 led the way with 16 points on 6 of 9 FG's and 4 of 4 FT's."
378,2023-03-04 03:50:37+00:00,LakersReporter,"Troy Brown Jr. and Malik Beasley, who combined for 7 triples at OKC last game, open a combined 3 for 3 tonight vs. MIN, with Brown Jr. hitting 2.

LAL lead 18-12."
379,2023-03-04 01:54:25+00:00,LakersReporter,"Darvin Ham noted the reality of LeBron and Russell both being out, but noted this message to the team:

“We have more than enough talent to still take care of our business.”"
380,2023-03-04 01:50:19+00:00,LakersReporter,"Davis and Schröder, as expected, are both good to go tonight, via Darvin Ham."
381,2023-03-03 01:31:12+00:00,LakersReporter,"LeBron and Russell remain out for Friday’s game.

Davis and Schröder are both probable."
382,2023-03-02 19:02:31+00:00,LakersReporter,"Medical update on @KingJames, via the team:

LeBron James has been evaluated by Lakers team physicians and medical staff, and it has been determined that he has sustained a right foot tendon injury. LeBron will be reevaluated in approximately three weeks."
383,2023-03-02 04:30:14+00:00,LakersReporter,"Huge second half from Schröder, fighting through an ankle sprain for 22 second half points:"
384,2023-03-02 03:55:35+00:00,LakersReporter,"Of his highly efficient shooting of late (68.2% FG’s over the last 14 days, 60% last 30), Austin Reaves said he’s aware of how much talent is on the floor, and how ball movement can create better, more open shots: “I try not to put myself in position to take a bad shot.”"
385,2023-03-02 03:52:48+00:00,LakersReporter,"“Tonight we took a big step chemistry wise,” said Austin Reaves, with LAL forced to figure things out on the fly without LeBron, AD and Russell on the floor.

Reaves stepped up with 19 points and 4 assists on 5 of 5 FG’s, and was 8 for 8 at the line before missing his last."
386,2023-03-02 03:23:38+00:00,LakersReporter,Will be a failed challenge by OKC. Dort was moving into Schröder.
387,2023-03-02 03:21:02+00:00,LakersReporter,"Austin Reaves: 5 for 5 from the field, and 7 for 7 from the line after 4 straight clutch time free throws (18 points).

LAL lead 120-115, with the ball, and 43.5 seconds to play (10 on the shot clock)."
388,2023-03-02 03:03:40+00:00,LakersReporter,"LAL up 105-92.

Schröder has been terrific in the 2nd half after hurting his ankle in the 1st.

After going 1 for 7 in the 1st, he's now 6 for 8 in the 2nd, for 16 of his 20 points.

Rui Hachimura has also been big, with 7 of his 9 points and 4 of 9 boards in the 2nd."
389,2023-03-02 02:47:22+00:00,LakersReporter,"LAL lead 90-84 after 3 (33-24 in 3rd Q).

To close it, Schröder caught I. Joe in too close to his body and swung through to draw bonus FT's with 13.5 seconds left, then drew a foul by hounding Giddey and selling contact from Williams, the screener."
390,2023-03-02 02:40:47+00:00,LakersReporter,"With Austin Reaves making some plays, LAL are up to 15 made 3's tonight, after B2B makes from Schröder (his 3rd) and Walker IV (his 1st).

Brown has 4, Bamba 3, Beasley 3, and Reaves 1.

LAL up 86-81 with 1:15 left in the 3rd."
391,2023-03-02 02:36:11+00:00,LakersReporter,"Troy Brown Jr.'s up to 17 points, his season high, and they've been needed, as LAL trail 79-76.

He's 4 of 6 from 3 tonight. He came in shooting 35.4% from distance."
392,2023-03-02 02:03:13+00:00,LakersReporter,"After going down by 8, LAL managed the final 5 points of the half, with a Schröder 3 and Vanderbilt dunk from Reaves.

OKC's lead is 60-57 at the break."
393,2023-03-02 01:52:04+00:00,LakersReporter,"After a tough shooting night in Memphis, Troy Brown Jr.'s had a  bounce-back night, starting 4 of 4 with 3 triples, plus a steal and assist for Beasley's 3rd, that has LAL up 48-44."
394,2023-03-02 01:40:20+00:00,LakersReporter,"LAL had an 11-point lead, but allowed OKC to trim it to just 1, at 31-30. Thunder got a bunch of wide open 3's against LAL's coverages, and made 7."
395,2023-03-02 01:31:01+00:00,LakersReporter,"Max Christie, who hasn't played much of late since LAL made its trade deadline acquisition, steps in and immediately gets a steal, and then a smooth pull-up jumper. LAL up 26-15."
396,2023-03-02 01:25:27+00:00,LakersReporter,Schröder is one of the tougher players in the league ... he's going to try and stay in the game.
397,2023-03-02 01:24:12+00:00,LakersReporter,"Already down LeBron, AD and D'Angelo, the Lakers really need the offensive creation from Dennis Schröder, who's been effective early breaking down OKC's defense.

And yet, Schröder just turned his ankle on a drive into traffic."
398,2023-03-02 01:19:49+00:00,LakersReporter,"LAL take an 18-13 lead into the first time out in OKC, boosted by 8 points from Troy Brown Jr. (2 of 2 from 3) and 5 from Malik Beasley (1 for 3 from 3).

After committing 27 TO's last night, they've yet to have a miscue at the 5:29 mark."
399,2023-03-02 00:30:05+00:00,LakersReporter,"Lakers starters at OKC in the absence of LeBron, AD and Russell:

Schröder, Beasley, Brown, Jr., Vanderbilt and Bamba"
400,2023-03-01 23:41:32+00:00,LakersReporter,"Ham explained that this was planned from a medical perspective, to keep both the short- and long-term health of the player - Davis in this case - as the top priority."
401,2023-03-01 23:26:25+00:00,LakersReporter,"Kenrich Williams is out for OKC, as is Shai Gilgeous-Alexander."
402,2023-03-01 21:01:05+00:00,LakersReporter,"Lakers at Thunder, Three Things to Know:

https://t.co/y9IjHCb36A"
403,2023-03-01 18:24:29+00:00,LakersReporter,"LAL will be shorthanded on this B2B at OKC tonight, with AD, LeBron and Russell all out. They'll require a rally-around-the-flag effort.

Meanwhile, Shai Gilgeous-Alexander is in health and safety protocols for OKC (and missed the prior 3 games with injuries)."
404,2023-03-01 03:01:44+00:00,LakersReporter,"Ham on missing LeBron: “You got arguably the best player to ever play the game, you’re going to feel his absence. That’s for damn sure. But we have capable players at all positions. It’s just a matter of us slowing down … and having a rhythm to what we’re doing.”"
405,2023-03-01 03:01:18+00:00,LakersReporter,"Re: the big TO margin (26-7), Darvin Ham said the Lakers  were trying to play the right way, but have to make quicker decisions on the catch. Either shoot it, quick drive down hill, or swing it to the next guy. Held it for too many extra seconds, took too many extra dribbles."
406,2023-03-01 02:51:48+00:00,LakersReporter,"Final: Grizzlies 121, LAL 109.

Without LeBron and D'Angelo Russell, LAL battled, but fell victim to a massive turnover margin of 26-6, too much to overcome despite a huge effort from Davis (28 points, 19 boards, 5 blocks) plus 17 points and 7 assists from Reaves."
407,2023-03-01 02:41:28+00:00,LakersReporter,"Anthony Davis has the NBA's only game of at least 30 points, 20 boards and 5 blocks, back in November at PHX.

Tonight, he has 25 points, 19 boards and 5 blocks with 3:10 to play.

LAL had cut the deficit to 4, but it's back to 8."
408,2023-03-01 02:34:15+00:00,LakersReporter,"Out of the time out, LAL have Jarred Vanderbilt defending Ja Morant."
409,2023-03-01 02:19:57+00:00,LakersReporter,"After Ja Morant completely dominated the 3rd Q, LAL get a 6-point swing to start the 4th, as Bane rimmed out on a 3, and Hachimura hit a triple for LAL to get the deficit to 6."
410,2023-03-01 02:04:14+00:00,LakersReporter,"In 24 minutes, @AntDavis23 has 20 points, 15 boards and 5 blocks. 

Game tied at 73 after his block on one end, and FT's on the other."
411,2023-03-01 01:52:58+00:00,LakersReporter,"LAL's going to need to get some 3's to fall from the starters around AD and Vanderbilt. Brown Jr., Beasley and Schröder are a combined 0 for 8 thus far.

Reaves and Walker IV do have 6 combined 3's off the bench."
412,2023-03-01 01:32:02+00:00,LakersReporter,"Just a fantastic defensive half from Anthony Davis, the biggest reason LAL is up 49-46 despite having 15 turnovers to  just 4 from the Grizzlies. 

Austin Reaves hitting 4 triples helped as well."
413,2023-03-01 01:25:55+00:00,LakersReporter,"Turnovers are killing LAL. They have 12 already, to just 3 from Memphis, after 2 in a row.

They were up 38-34, before an 8-0 Memphis run had them down 42-38.

Austin Reaves had an answer, though, with an and-1 3, to tie it at 42."
414,2023-03-01 01:14:40+00:00,LakersReporter,AD has been dominant in the LAL defensive paint. He has 4 blocks already.
415,2023-03-01 01:12:39+00:00,LakersReporter,"Lonnie Walker IV's 2nd triple in 4 attempts gave LAL a 35-34 lead. He's been part of a big bench scoring effort for the shorthanded Lakers. Bench has 24 points, starters 11. 

Memphis had 35 points, but a Bane 3 was overruled to a 2 (he had his foot on the line)."
416,2023-03-01 00:58:32+00:00,LakersReporter,"Tyus Jones, one of the more underrated reserves in the NBA, scored 5 straight points to put Memphis up 23-20 after LAL had taken the lead on a Wenyen Gabriel putback as Gabriel gets the early backup 5 minutes over Bamba."
417,2023-03-01 00:48:41+00:00,LakersReporter,"Anthony Davis has drawn 3 PF's already, the most recent on Memphis putting him on the free throw line at the 4:49 mark.

All tied at 14 after he split a pair; AD has 6 points and 6 boards."
418,2023-03-01 00:01:01+00:00,LakersReporter,"Schröder, Beasley, Brown Jr., Vanderbilt and Davis will start at Memphis."
419,2023-02-28 23:38:32+00:00,LakersReporter,"D’Angelo Russell is officially out tonight in Memphis. Darvin Ham said he has doubt that Russell will be ready to go at OKC tomorrow, but hasn’t ruled that out.

LAL will need Schöder and Reaves especially to pick up the playmaking with LeBron also out."
420,2023-02-28 23:07:05+00:00,LakersReporter,"Darvin Ham said it’s obviously a huge loss to miss LeBron for however long he’s out, but they have to proceed full steam ahead with their goals, and work to get into the playoff picture."
421,2023-02-28 23:04:33+00:00,LakersReporter,"Darvin Ham said LeBron James is going through medical evaluation that’s ongoing, so there’s no update just yet."
422,2023-02-28 22:04:52+00:00,LakersReporter,"Lakers vs. Grizzlies, Three Things to Know:

https://t.co/eQ8uxpSBmt"
423,2023-02-27 23:15:12+00:00,LakersReporter,"Lakers injury update for Tuesday in Memphis:

Davis: probable 
LeBron: out (right foot soreness)
Russell: doubtful (right ankle sprain)"
424,2023-02-27 00:23:21+00:00,LakersReporter,"AD on having Vanderbilt in the lineup alongside him and LeBron:

“It gives us a lot more freedom on the defensive end.”

They can switch, stay home, trap and recover … all three can handle bigs and wings."
425,2023-02-27 00:18:52+00:00,LakersReporter,"LeBron said his foot/ankle “has been better,” but it was important for him to finish the game. He’ll get treatment and monitor it ahead of the next two games (Tuesday/Wednesday B2B)."
426,2023-02-27 00:17:45+00:00,LakersReporter,"LeBron on the Lakers since the trade deadline (they’re 4-1 since acquiring Russell, Vanderbilt and Beasley):

“I feel like we’re in a good place. We’re gonna try to continue that.”"
427,2023-02-27 00:06:40+00:00,LakersReporter,Jarred Vanderbilt after his huge impact towards L.A.‘s win at Dallas. https://t.co/u67clk9pzi
428,2023-02-26 23:35:47+00:00,LakersReporter,"With this third straight win coupled with some other losses in the West, the Lakers are up to 11th, one game back of New Orleans for 10th, and 2.5 back of Dallas for 6th. https://t.co/IRqquXxQw8"
429,2023-02-26 23:32:22+00:00,LakersReporter,"Darvin Ham said that LeBron’s “Good”, when asked about his foot/ankle, after that early 4th Q scare. 

LeBron obviously stayed in and closed the game. The medical staff will evaluate him as usual, with any update pending."
430,2023-02-26 23:30:28+00:00,LakersReporter,"Darvin Ham on Jarred Vanderbilt (15P, 17R, 4S) who was huge in the 3rd Q especially:

“His defense on Luka, his energy .., that’s a tall task to try and manage that matchup, as skilled as Luka is. He was up for the challenge to try and make it as difficult as possible.”"
431,2023-02-26 23:13:18+00:00,LakersReporter,Lakers managed to trim clock with Schröder avoiding the foul. Only 2.2 left now. Mavs can’t advance it.
432,2023-02-26 23:12:08+00:00,LakersReporter,"Lakers need two FT makes after a time out to get the lead back to three. Mavs have no time outs, and 5.4 left on the clock."
433,2023-02-26 23:09:31+00:00,LakersReporter,"Huge all game, Jarred Vanderbilt crowed Doncic and forced a critical turnover. Perhaps Luka could have just picked it up, but the turnover gives LAL the ball, up 3, with a chance to get to the foul line. Just 12.7 seconds left."
434,2023-02-26 23:04:33+00:00,LakersReporter,"LeBron's been terrific backing the smaller Mavs wings into the paint, patiently up-faking, stepping through and finishing."
435,2023-02-26 23:00:34+00:00,LakersReporter,"Austin Reaves. Clutch.

Lakers up 2 with 2:46 to play after his triple."
436,2023-02-26 22:58:55+00:00,LakersReporter,"Schröder, Reaves, LeBron, Vanderbilt and AD vs. Irving, Holiday, Bullock, Luka and Powell for the final 3 minutes."
437,2023-02-26 22:39:23+00:00,LakersReporter,A 5-0 LeBron run to start the 4th has LAL up 2.
438,2023-02-26 22:36:56+00:00,LakersReporter,"LAL outscored DAL 31-20 in the 3rd Q, to trim the 14-point halftime deficit to three, at 81-78.

Mavs led 59-37 late in the 2nd Q, with the Lakers flipping the script since then."
439,2023-02-26 22:21:28+00:00,LakersReporter,"In the 3rd Q alone, Jarred Vanderbilt has 8 points, 8 boards and 3 steals, including offensive boards on the last 2 trips. Still 4:21 to play in the 3rd. 

13, 13 and 4 overall."
440,2023-02-26 22:18:40+00:00,LakersReporter,"Tough swing for LAL, as both Beasley and Schröder missed wide open 3's, and Dallas got a counter 3 in transition to make it 75-67.

Lakers, nonetheless, are back in it."
441,2023-02-26 22:15:34+00:00,LakersReporter,"Vanderbilt has been massive for LAL on both ends. Dallas lead, once 27, is down to 5."
442,2023-02-26 22:10:09+00:00,LakersReporter,"Consecutive buckets at the rim from Jarred Vanderbilt, the 2nd coming after his solo rebound and transition push with a hesitation move, have LAL within 11."
443,2023-02-26 21:46:50+00:00,LakersReporter,"LAL gave themselves a shot at a comeback by trimming what had ballooned to a 27-point deficit to 14, at 61-47, at the half."
444,2023-02-26 21:21:46+00:00,LakersReporter,"There are shades of LAL's Feb. 13 loss at Portland, when they gave up 17 1st half 3's, and couldn't hang in.

Dallas is now 9 for 15 from 3, with B2B tough, contested makes from Hardaway Jr. making it a 38-18 deficit."
445,2023-02-26 21:08:58+00:00,LakersReporter,"Dallas is 7 for 11 from 3, and LAL 0 for 9, the obvious early difference in the game.

Mavs up 26-15."
446,2023-02-26 19:19:45+00:00,LakersReporter,"As expected, D’Angelo Russell is officially out today in Dallas due to the ankle sprain."
447,2023-02-26 19:05:29+00:00,LakersReporter,"Expect Dennis Schröder to replace D’Angelo Russell in the starting lineup, with Russell doubtful to play due to the ankle sprain."
448,2023-02-26 17:25:19+00:00,LakersReporter,Bonus pod! 👇🏻👇🏻
449,2023-02-25 22:22:25+00:00,LakersReporter,"D’Angelo Russell is doubtful to play at Dallas tomorrow due to the right ankle sprain he suffered early in the Golden State game on Thursday.

Meanwhile, LeBron and AD are both probable."
450,2023-02-24 05:52:01+00:00,LakersReporter,"Anthony Davis, postgame, on Reaves: “He can do it all. Nothing surprises me with Austin … he’s very talented.”"
451,2023-02-24 04:59:42+00:00,LakersReporter,"X-rays on D’Angelo Russell’s ankle were negative, and he’ll be day-to-day moving forward. 

Russell left the game in the first quarter after turning his ankle when he stepped on DiVincenzo’s foot. He had 2 points, 4 boards and 3 assists in his 9 minutes."
452,2023-02-24 04:51:24+00:00,LakersReporter,"Austin Reaves is up to 17 points, on 6 of 6 FG's and 4 FT's, plus 3 assists after finding Beasley for his 6th 3 of the night. 

LAL stretch their lead to 92-76, with both LeBron and AD resting late in the 3rd."
453,2023-02-24 04:32:59+00:00,LakersReporter,"Strong bench game from Austin Reaves here, in for Beasley (4 PF's), and immediately with 7 straight points (a 3, 2 FT's and a 2).

LAL up 74-63."
454,2023-02-24 04:11:10+00:00,LakersReporter,"Up 56-45 with 2:22 left in the 1st half, LAL then allowed an 11-3 run that has GSW within 3 at a half that the Lakers otherwise controlled."
455,2023-02-24 04:00:10+00:00,LakersReporter,D'Angelo Russell is out for the rest of the game due to a right ankle sprain.
456,2023-02-24 03:55:41+00:00,LakersReporter,"A nice pass from Davis got Vanderbilt a transition dunk to give LAL their biggest lead thus far, at 51-38, with 4:36 left in the half. Warriors are shooting just 32.5% from the field, to LAL's 48.6%."
457,2023-02-24 03:33:52+00:00,LakersReporter,"Dennis Schröder keyed an 8-0 LAL run to close the 1st Q, enough for a 31-23 lead.  

GSW, missing Curry and Wiggins,  shot 34.6%, and struggled to get anything at the rim when Davis was in."
458,2023-02-24 03:24:53+00:00,LakersReporter,"Despite 5 early turnovers, the Lakers lead GSW 19-15 at the 3:12 mark, hitting 7 of 15 FG's, relative to GSW's 6 for 19.

Malik Beasley leads the way with 8 points on 3 of 3 FG's (2 triples)."
459,2023-02-23 21:41:20+00:00,LakersReporter,"Digging into the team’s approach coming out of the All-Star break, starting tonight against Golden State: 👇🏻👇🏻"
460,2023-02-16 06:29:25+00:00,LakersReporter,"LeBron said he was pleased with LAL’s trade deadline. Amongst the new starters, he praised Russell’s skillset and IQ, called Malik Beasley a “laser” that LAL haven’t had, where defenses have to respect him, and Vanderbilt a “Swiss Army Knife” who can do a bit of everything."
461,2023-02-16 06:05:08+00:00,LakersReporter,"D’Angelo Russell on playing alongside LeBron and AD: “It’s just easy.”

He added that, “When your two best players are willing passers and selfless,” it just makes things flow. 

Lakers had 32 assists on 44 buckets, and got to the FT line 36 times."
462,2023-02-16 05:59:01+00:00,LakersReporter,"AD: “Tonight there was a huge emphasis on getting this win … guys came out flying.”

Davis cited Russell’s shooting/playmaking, Vanderbilt’s defense and know how, + the spacing Beasley provides as points of emphasis for the new-look starting lineup. AD and Russell were both +18."
463,2023-02-16 05:48:49+00:00,LakersReporter,"Darvin Ham said the design of the new starting lineup, the 3 newcomers alongside LeBron and AD, was to create balance on the floor with the starters and bench. Clearly, it couldn’t have started much better: “I thought we had a well-balanced attack and were great defensively.”"
