,Date,User,Tweet
698,2023-01-17 06:58:02+00:00,LakersReporter,"Big night for Wenyen Gabriel, who continues to see his role increase for the Lakers. Gabriel has led LAL in net rating for two straight years now (limited sample size last year, as he joined on a 10-day in March). 

Walk off after 14 and 9 in a win over Houston:"
699,2023-01-17 06:26:02+00:00,LakersReporter,"Coming into tonight’s game, LeBron 
had these numbers on the second night of back-to-back sets of games (3 games): 

34.3 points, 52.2% FG, 43.5% 3’s

After his 48 points on 16 of 26 FG’s and 5 of 10 3’s, those averages go up considerably.

H/T @forumbluegold"
700,2023-01-17 06:10:35+00:00,LakersReporter,"The Lakers set a record for the franchise with only two turnovers tonight. Previous low was 3, twice, in 2001 and 2011."
701,2023-01-17 05:46:35+00:00,LakersReporter,"After a 9-0 Houston run, LeBron returned to the game, and promptly converted an and-1 in the paint with a fading J.

He has 40 points, and LAL lead 122-116 with 4:45 to play."
702,2023-01-17 05:26:03+00:00,LakersReporter,"In a game LeBron has again been dominant offensively (28 points on 17 shots) and is +13, LAL's lead is down to 4 heading into the 4th, after a late 3rd Q run from Houston sparked by Jalen Green's 3 triples."
703,2023-01-17 05:23:24+00:00,LakersReporter,"Looking at the box scores, Jabari Smith Sr. didn't get into the game for LeBron's debut when he was on the Sacramento roster ... but Smith Sr. did play against LeBron 3 times in the next season (2004-05), when Smith Sr. played for New Jersey."
704,2023-01-17 05:07:04+00:00,LakersReporter,"LeBron hit 2 straight 3's on top of a long 2, then just rimmed out on a 4th straight J, also from 3.

He has LAL back on top at 84-71 before a Rockets jumper snapped the James push.

LeBron has 26 points on 10 of 15 FG's with 4 triples, more than he'd hit in his previous 5 games."
705,2023-01-17 04:56:28+00:00,LakersReporter,"LeBron played against Jabari Smith Jr.'s dad a few times in Smith's NBA stint, including an April 5, 2005 contest, when Smith Sr. had 4 points off the bench. 

LeBron had 24 points, 9 boards, 4 assists, 2 blocks and 2 steals."
706,2023-01-17 04:43:28+00:00,LakersReporter,"LeBron's showing rookie Jabari Smith Jr., and the rest of Houston's young players, why he's perhaps the best transition player in NBA history with a series of fast break buckets to push LAL's lead to 12 at halftime."
707,2023-01-17 04:21:27+00:00,LakersReporter,"LAL have picked up their transition game in the 2nd Q, with Gabriel (a put back) LeBron and Nunn all scoring at the rim.

Lakers have a 9-0 fast break points edge, and lead 44-35 early in the 2nd."
708,2023-01-17 04:15:03+00:00,LakersReporter,"LAL led 37-32 with 00.5 seconds left in the 1st Q when JTA fouled Eric Gordon as he swung up to take a 3, resulting in Gordon's 6th, 7th and 8th FT's of the 1st Q.

As a result, it's just a 2-point lead after 12 minutes. Houston scored 22 points in the paint and made 11 FT's."
709,2023-01-17 03:01:04+00:00,LakersReporter,"Lakers will start Schröder, Beverley, Brown Jr., LeBron and T. Bryant against Houston tonight."
710,2023-01-17 02:45:45+00:00,LakersReporter,LeBron and Troy Brown Jr. are both available tonight.
711,2023-01-17 02:03:21+00:00,LakersReporter,"Darvin Ham said Patrick Beverley is available tonight after missing the last two games. 

Meanwhile, it will still be a few days before there’s an update on Walker IV and Reaves (two weeks from Jan. 6)."
712,2023-01-16 04:50:27+00:00,LakersReporter,"It's been a battle of paint points (huge edge from the Lakers, at 70-50) and 3's + FT's (big edge from Sixers, at 12 to 5 made 3's and 15 to 10 FT's).

Sixers lead 111-109 with 1:05 to play, moments after a go-ahead triple (Niang)."
713,2023-01-16 04:44:28+00:00,LakersReporter,Darvin Ham is 9-1 on challenges this year after winning another to turn a shooting foul (Harden with his typical move) into a side-out-of-bounds foul.
714,2023-01-16 04:14:28+00:00,LakersReporter,"LAL had a 3-point lead at 79-76, before a trio of Sixers 3's capped a 9-2 run to put them up 4 late in the 3rd Q."
715,2023-01-16 03:34:03+00:00,LakersReporter,"LAL closed the first half on a 9-0 run, with Westbrook and LeBron getting up and down in transition at will, enough for a 58-57 edge."
716,2023-01-16 03:09:11+00:00,LakersReporter,"A last-second bucket from Wenyen Gabriel sent the Lakers into the 2nd Q with a 33-32 deficit. 

LeBron had 16 points to lead the way."
717,2023-01-16 02:52:34+00:00,LakersReporter,"LeBron James just became the 2nd player ever to reach 38,000 points (Kareem).

He's currently 386 points from tying Abdul-Jabbar."
718,2023-01-14 22:42:09+00:00,LakersReporter,Injury update ahead of Sunday’s game against Philly: https://t.co/LH0LAcxWfH
719,2023-01-13 06:40:15+00:00,LakersReporter,"LeBron gave Luka credit for hitting tough shots, and Dallas for making more plays.

He noted the difficulty of having so many guys in and out of the lineup, mostly due to injuries. Having “A billion different lineups” disrupts continuity, and ability to settle on a closing group."
720,2023-01-13 04:57:06+00:00,LakersReporter,Luka Doncic hasn't rested in the 2nd half. He's at 36 minutes right now with 6:27 to play.
721,2023-01-13 04:44:43+00:00,LakersReporter,"The Lakers trimmed three points off the halftime deficit with a 28-23 3rd Q, and trail 82-76 with 12 minutes to play.

The FT line has hurt LAL tonight, as they've made just 11 of 18; they're also cold from 3, at 5 for 23.

They're +10 in the paint, and have 3 fewer TO's."
722,2023-01-13 04:31:28+00:00,LakersReporter,"After going 0 for 2 in the first half, rookie Max Christie is 3 for 4 in the 2nd, with his 3-pointer following a transition layup that trimmed the Mavericks lead to 77-68."
723,2023-01-13 02:35:10+00:00,LakersReporter,"Rookie Max Christie gets his 2nd straight start tonight against Dallas, joining Dennis Schröder, Juan Toscano-Anderson, LeBron James and Thomas Bryant."
724,2023-01-12 19:10:19+00:00,LakersReporter,Update: Patrick Beverley won’t play tonight due to a non-Covid illness.
725,2023-01-12 01:20:04+00:00,LakersReporter,Good news for the Lakers to potentially get Troy Brown Jr. back after he missed three straight games. He had been playing well before straining his quad. https://t.co/NqKfvNctaz
726,2023-01-10 05:11:42+00:00,LakersReporter,Max Christie said he was told about 40 minutes before the game that he’d be getting his first start. His first action was to excitedly text his mom.
727,2023-01-10 05:09:40+00:00,LakersReporter,"Kendrick Nunn on Max Christie, who had a season-high 14 points on 6-of-8 FG’s:

“Max is special. He’s a sponge. He listens. Plays hard. Competes. That’s always a gift to have as a rookie. I think he’s doing everything the right way … puts in work. He’s a hard worker.”"
728,2023-01-10 04:22:56+00:00,LakersReporter,"Final: DEN 122, LAL 109.

L.A.'s 5-game winning streak is snapped on their 3rd game in 4 nights, sans LeBron/AD/Reaves/Walker IV/Brown Jr., and Beverley for the 2nd half.

Rookie Max Christie had a season-high 14 points on 6 of 8 FG's."
729,2023-01-10 04:17:44+00:00,LakersReporter,Malone calls time out with 1:55 left and Denver up 118-105.
730,2023-01-10 03:53:15+00:00,LakersReporter,"Lakers have battled tonight, but the injury absences have added up on the 3rd game in 4 nights coming off the B2B wins on Friday and Saturday.

LAL had to start the 4th Q with two rookies and 10-day-contracted Sterling Brown, and Denver's regular 2nd unit has taken advantage."
731,2023-01-10 03:41:31+00:00,LakersReporter,"Strong night for LAL's rookies, with Max Christie starting and going 3 for 5 with a pair of 3's, and Cole Swider adding 2 triples of his own off the bench.

LAL hanging in there, trimming the lead to as few as 5 here late in the 3rd Q."
732,2023-01-10 03:29:20+00:00,LakersReporter,"A 12-7 run to start the 3rd Q from the shorthanded Lakers forced a Nuggets time out. They still lead by 9 at 69-60 with 7:18 left in the period. 

Nunn is up to 13 points on 5 of 9 FG's off the bench (started the 3rd for Beverley)."
733,2023-01-10 03:22:04+00:00,LakersReporter,"Patrick Beverley is out for the remainder of the game with a right hip injury. 

He joins LeBron, AD, Reaves, Walker IV and Brown Jr. on the injured list for tonight."
734,2023-01-10 02:33:07+00:00,LakersReporter,"Five straight points from Wenyen Gabriel, an and-1 and then a 3, plus a Kendrick Nunn dunk have LAL on a 7-0 run out of a time out, and right back into the game."
735,2023-01-10 02:29:08+00:00,LakersReporter,"Decent start by the Lakers, until a 10-0 run from Denver gave the Nuggets a 22-13 early cushion. The run included three Lakers turnovers, plus a take foul."
736,2023-01-10 01:36:47+00:00,LakersReporter,"It's yet another new starting lineup tonight with Max Christie drawing the assignment at Denver, No. 22 on the season.

He joins Schröder, Beverley, JTA and Bryant."
737,2023-01-09 21:52:40+00:00,LakersReporter,👇🏻👇🏻
738,2023-01-09 21:02:12+00:00,LakersReporter,Update: LeBron is out tonight.
739,2023-01-09 20:34:32+00:00,LakersReporter,"LeBron was named Western Conference Player of the Week after leading LAL to a 4-0 record, averaging 35.0 points (54.8% FG’s) with 8.7 boards and 7.7 assists.

@KingJames adds to his league-record 66 career weekly awards (5 with the Lakers, and first since December of 2021)."
740,2023-01-09 20:17:47+00:00,LakersReporter,Troy Brown Jr. will miss his third straight game tonight due to a quad strain.
741,2023-01-09 19:20:11+00:00,LakersReporter,"LeBron James has been downgraded from probable to questionable for tonight's game in Denver, due to left ankle soreness."
742,2023-01-09 18:43:57+00:00,LakersReporter,"Lakers at Nuggets, Three Things to Know:

https://t.co/pdlqjCFnzq

LAL ride a 5-game winning streak into Denver; Lakers are 2-1 in the series this season, while the Nuggets are an NBA-best 16-3 at home."
743,2023-01-08 23:18:26+00:00,LakersReporter,Injury report for tomorrow at Denver: https://t.co/84w5mTkhh1
744,2023-01-08 06:34:54+00:00,LakersReporter,* @nolimittb31 has been huge for the Lakers of late; he joined us for the walkoff on @SpectrumSN after dropping 29 points with 14 boards in Sacramento:
745,2023-01-08 06:18:45+00:00,LakersReporter,"After starting the season 3-10, with a number of tough losses in competitive games, the Lakers got Thomas Bryant and Dennis Schröder back from respective thumb injuries. 

LAL have gone 16-11 since, despite being without Anthony Davis for the last 12.5 games."
746,2023-01-08 05:55:02+00:00,LakersReporter,"Lakers currently have the NBA's longest active winning streak at 5 games (tying Memphis), despite being without Anthony Davis, and more recently, Lonnie Walker IV, Austin Reaves and Troy Brown Jr."
747,2023-01-08 05:53:07+00:00,LakersReporter,"Darvin Ham on LAL shooting 61% tonight: 

""Seventy points in the paint. That’s who we are. We want to play fast, physical and free, with force. That was a representation of our physicality. Guys not settling, staying in constant attack mode."""
748,2023-01-08 05:12:10+00:00,LakersReporter,"LeBron has 1 more FT coming out of a time out, for a chance to put LAL up 8 with 8:48 to play, one point away from their biggest lead. 

It's a 9-2 run to start the 4th Q as is. 

LAL's energy remains high on this night 2 of the B2B (SAC last played on Wednesday)."
749,2023-01-08 05:07:14+00:00,LakersReporter,"Schröder and Bryant are a combined 16 for 19 tonight, including 4 of 4 from 3 from the German."
750,2023-01-08 05:00:48+00:00,LakersReporter,"LAL scored the final 4 points of the 3rd Q, enough to knot the score at 109 in a total offensive showcase.

The fewest either team has scored in a quarter is 35. 

Lakers are at 61.5% from the field."
751,2023-01-08 04:42:44+00:00,LakersReporter,"Thomas Bryant continues to be a very efficient source of offense for the Lakers, up to 19 points on just 9 FGA's (7 made FG's, + 5 FT's)."
752,2023-01-08 04:32:04+00:00,LakersReporter,"Smart. After Sabonis got called for his 3rd PF, LeBron went straight at him, twice. First time, Sabonis got out of the way for a LeBron dunk. Second time, LeBron drew a Sabonis PF, his 4th. 

Domantas sits with 9:33 left in the 3rd, and LAL down 2."
753,2023-01-08 04:13:05+00:00,LakersReporter,"L.A. and SAC came into this game averaging 242.0 points per game in their prior 2 games, 2nd in the NBA only to MIN and HOU (via Sportradar) ... well, tonight they're on pace for 292 points, with a 73-all first half.

LAL shot 62.8% (9 of 13 3's). Kings shot 48.9% w/17 FT's."
754,2023-01-08 04:10:27+00:00,LakersReporter,"After shooting 34.0% from 3 in December with 1.2 makes per game, Dennis Schröder is 14 for 22 in 4 January games, good for 63.6%, and 3.5 makes per game, with the 2nd half still to come tonight (4 for 4 thus far)."
755,2023-01-08 04:02:29+00:00,LakersReporter,"LAL are shooting 64.9%, including 8 of 12 from 3, after makes from Schröder (his 3rd) and Westbrook (his 2nd).

Game's tied at 62 as the offenses take turns."
756,2023-01-08 03:58:43+00:00,LakersReporter,"Free throw attempts are now 15 for Sacramento, and 6 for the Lakers. LeBron drew a technical - LAL's second - for arguing about it after he didn't get an and-1 call, and Fox did.

A 6-0 Kings run has them up 60-52."
757,2023-01-08 03:38:22+00:00,LakersReporter,"LAL trail 38-37 after 1, after leading by as many as 9 earlier in the period. The 3 triples from Mitchell made a late impact, as did a 4-1 edge on the offensive glass, including a late FT miss Lyles grabbed to get 2 extra FT's."
758,2023-01-08 03:36:35+00:00,LakersReporter,"Kings guard Davion Mitchell is 3 for 3 from 3, the most triples he's hit in a game since October, and the first time he's hit 2 since Dec. 21 vs. the Lakers.

He's shooting 30.2% from 3 this season."
759,2023-01-08 01:58:35+00:00,LakersReporter,Update: LeBron is in.
760,2023-01-08 01:38:22+00:00,LakersReporter,"LeBron remains questionable, until he goes through his pregame routine. There’s no rule for him with back to backs; he played in L.A.’s last one (ORL/MIA last week) and had also missed the second end in previous sets."
761,2023-01-07 21:01:21+00:00,LakersReporter,Injury update for tonight’s back to back at Sacramento: https://t.co/DhfOA03fUM
762,2023-01-07 06:22:43+00:00,LakersReporter,"“Night and day,” said Kendrick Nunn (season high 23 points) about how he feels now vs. where he started the season. “Just trying to figure out spots on the floor, chemistry and things like that. I’ve been watching a lot (from the bench) … and opportunity knocks … I’m ready.”"
763,2023-01-07 06:22:04+00:00,LakersReporter,"LeBron said he wasn't able to get on the floor and work since LAL's game on Monday, as he tried to rest and get better from the cold that kept him out of Wednesday's game. He found a rhythm in the 4th Q, attacking the paint and getting up and down in transition."
764,2023-01-07 05:42:28+00:00,LakersReporter,"Final: LAL 130, ATL 114.

LeBron had 25, 10 and 7, and T. Bryant 19 and 13, plus 23 off the bench from Nunn.

LAL win a 4th straight game, and 5th in 6 contests to improve to 6-5 since Davis got hurt (7-5 including the Denver game he left in the 1st half), and 18-21 overall."
765,2023-01-07 05:37:10+00:00,LakersReporter,"LeBron started the game slowly from an efficiency standpoint, and was 6 for 15 early in the 4th Q before 4 straight buckets at the rim - old reliable - got him to 10 for 19 (He's 9 of 11 in the paint).

Coming into tonight, @KingJames had 11 straight games of at least 50% FG's."
766,2023-01-07 05:15:48+00:00,LakersReporter,"With Atlanta trying to chip away at LAL's lead, Kendrick Nunn and Max Christie hit B2B 3's in the final 35 seconds of the 3rd Q, enough to send LAL into the 4th with a 98-82 lead after the Hawks had cut a once 26-point lead to 10."
767,2023-01-07 04:57:34+00:00,LakersReporter,"Coming off a 32-point game in LAL's win over Miami on Wednesday, Dennis Schröder is 4 for 4 from 3 tonight towards his 15 points thus far."
768,2023-01-07 04:37:28+00:00,LakersReporter,"LAL head into halftime with a 70-49 lead, their biggest margin at the break this season.

Lakers shot 56.9% to ATL's 32.7%, hitting 4 more triples, and winning the fastbreak point battle 22-3."
769,2023-01-07 04:24:21+00:00,LakersReporter,"LAL are dominating Atlanta in transition, up 22-0 in fastbreak points.

Lakers lead 57-32, behind 59.0% FG's to ATL's 28.9%, midway through the 2nd Q."
770,2023-01-07 04:08:43+00:00,LakersReporter,"A strong 1st Q for the shorthanded Lakers produced a 37-28 lead over Atlanta. LAL hit 57.7% of their shots, and held ATL to 40.9%. 

Hawks (8 of 8) were +4 at the FT line, with LAL missing 3 of their 7 attempts.

Just 2 TO's for LAL, compared to ATL's 4."
771,2023-01-07 03:03:04+00:00,LakersReporter,"Schröder, Beverley, Toscano-Anderson, LeBron and Bryant will start vs. Atlanta tonight."
772,2023-01-06 18:54:04+00:00,LakersReporter,"With all their injuries, LAL called up some help in the form of Sterling Brown, who has familiarity with Darvin Ham from his time in Milwaukee: https://t.co/14VRB8lx9c"
773,2023-01-06 18:36:06+00:00,LakersReporter,Update: Troy Brown Jr. has been downgraded to out for tonight.
774,2023-01-06 18:01:31+00:00,LakersReporter,"Medical update from the Lakers:

Austin Reaves has been diagnosed with a left hamstring strain and will be reevaluated in approximately two weeks. 

Lonnie Walker IV has been diagnosed with left knee tendinitis and will be reevaluated in approximately two weeks."
775,2023-01-06 01:22:52+00:00,LakersReporter,"Reacted to the win vs. Miami, and discussed some of the injuries below: 👇🏻👇🏻"
776,2023-01-06 01:21:40+00:00,LakersReporter,Lakers injury update for tomorrow vs. Atlanta: https://t.co/gyJsJfPyaS
777,2023-01-05 18:36:12+00:00,LakersReporter,"First All-Star voting returns are out, with @KingJames No. 1 overall, @AntDavis23 third for West frontcourt, Westbrook 6th for guards, and Austin Reaves 9th: https://t.co/hpXPEUH6JZ"
778,2023-01-05 06:10:19+00:00,LakersReporter,"Schröder closed the game out by scoring 9 of his 32 points in the final 3 minutes, and then kept his beautiful 1-month old baby boy asleep while doing the walkoff:"
779,2023-01-05 05:31:41+00:00,LakersReporter,"Oladipo split the FT's, and Dennis Schröder, who's taken an elbow to the face and sprained his ankle tonight, blew past Martin for a layup to reach 30 points, tying his season high.

LAL up 4 with 20 seconds left."
780,2023-01-05 05:30:48+00:00,LakersReporter,"The Lakers win the challenge ... but it's a pyrrhic victory for LAL, as the refs just changed it from a foul on Westbrook to a block on Reaves. Lakers do save a time out."
781,2023-01-05 05:29:14+00:00,LakersReporter,"Refs let the initial play go, which looked like it could have been a charge on Oladipo. We'll see if they reverse it (would be LAL ball up 3), or if they keep the original call, which would put Oladipo at the FT line with 39.5 seconds left and LAL up 106-103."
782,2023-01-05 05:27:50+00:00,LakersReporter,"Significant challenge here, as Oladipo drove right into Austin Reaves ... but the call was on Westbrook, who came in after Reaves fell, and fouled Oladipo from behind."
783,2023-01-05 05:13:55+00:00,LakersReporter,"Schröder made both FT's and is currently staying in the game, battling through the ankle roll ...
and then he hit a go-ahead 3 to pay off a Westbrook steal."
784,2023-01-05 05:12:44+00:00,LakersReporter,"Miami leads the NBA in paint points against, giving up just 44.5, including 36.0 in the last 3.

Despite LeBron and AD being out, and MIA often dropped off into a zone, LAL haven't settled, and have 48 points in the paint thus far.

On the other end, however, they've given up 60."
785,2023-01-05 05:11:09+00:00,LakersReporter,"Down LeBron, AD, Walker IV and Troy Brown already tonight, LAL just saw Dennis Schröder roll his ankle on a drive to the rim (he has 2 FT's coming).

He's re-tying his shoes on the bench during a time out.

LAL trail 90-87 with 5:41 to play."
786,2023-01-05 04:50:59+00:00,LakersReporter,"LAL managed the last 4 points of the 3rd Q, enough to take a 79-78 lead into the final period.

Lakers are shooting 47.5% overall, and 29.2% from 3 (7 makes), to MIA's 47.2%, and 20% from 3 (4 makes). LAL +8 at the FT line, but -4 in the TO battle."
787,2023-01-05 04:32:37+00:00,LakersReporter,Troy Brown Jr. is out for the rest of the game with a left quad strain.
788,2023-01-05 04:08:47+00:00,LakersReporter,"LAL take a 52-48 lead into halftime, holding Miami to 42.9% FG's (25% from 3).

Westbrook keyed a bench push with 12 points, 6 assists and 5 boards, and also had 7 of the team's 12 turnovers. Wenyen Gabriel had 7 points off the pine."
789,2023-01-05 03:52:42+00:00,LakersReporter,"After opening a 13-point lead, LAL gave up a quick 7-0 run, Miami trimming the margin to 42-36 with 6:29 left in the 2nd Q."
790,2023-01-05 03:36:50+00:00,LakersReporter,"Wenyen Gabriel's corner 3 beat the 1st Q buzzer, putting the shorthanded Lakers up 32-23 on Miami.

LAL had 8 players make at least 1 shot in the 1st Q, and scrapped defensively to force 5 Miami turnovers."
791,2023-01-05 02:30:50+00:00,LakersReporter,"Schröder, Beverley, Reaves, Toscano-Anderson and Bryant starting for the shorthanded Lakers vs. Miami."
792,2023-01-05 01:16:37+00:00,LakersReporter,Russell Westbrook is available tonight (upgraded from probable).
793,2023-01-04 20:36:13+00:00,LakersReporter,"Update for tonight from the Lakers:

LeBron James (non-COVID illness) and Lonnie Walker IV (left knee soreness) have been downgraded to OUT for tonight’s game vs. Miami."
794,2023-01-04 00:45:53+00:00,LakersReporter,"Russell Westbrook is probable to play tomorrow after missing the second half in Charlotte with left foot soreness, while LeBron James (45 ppg in two games as a 38-year-old) and Lonnie Walker IV (out the last two games) are questionable."
795,2023-01-03 01:48:38+00:00,LakersReporter,"LAL take a 94-76 lead into the 4th Q, after allowing a 31-point 3rd to Charlotte, whom they'd held to 45 1st half points.

The Lakers scored 34 of their own, however, with LeBron up to 32 points with 9 boards and 5 assists."
796,2023-01-03 01:37:01+00:00,LakersReporter,Russell Westbrook is out for the rest of the game due to left foot soreness. He missed two games (12/19 and 12/21) with that.
797,2023-01-03 01:30:55+00:00,LakersReporter,"LeBron got the (tons of) Lakers fans, and several Hornets fans in the building on their feet by finishing an alley-oop from Schröder with a 2-handed reverse.

Lakers up 20."
798,2023-01-03 01:21:44+00:00,LakersReporter,"LeBron is well on his way to an 11th straight game of at least 50% from the field. 

He's 11 of 17 towards 23 points in 21 minutes, despite going 0 for 3 from 3."
799,2023-01-03 01:04:39+00:00,LakersReporter,"Lakers up 60-45 at the half after a 6-0 run in the final 33 seconds was capped by Austin Reaves, who stole a careless PF Washington inbounds pass and sank a buzzer-beating J.

Reaves, coming off 2 tough shooting games, had 13 points on 4 of 6 FG's (2 of 2 3's) with 3 FT's."
800,2023-01-03 00:41:31+00:00,LakersReporter,"LeBron returned, and LAL's offense started working quite well again.

He's now a +20 for the game (11 points, 5 boards, 2 assists) after leading a 14-0 run to start the 2nd Q.

Lakers up 36-21."
801,2023-01-03 00:30:17+00:00,LakersReporter,"LAL's offense has really struggled since LeBron went out, with several pull-up jumpers (Westbrook is 0 for 3) plus the 5th turnovers thus far. 

Lakers 9-point lead is down to 1 at 22-21."
802,2023-01-03 00:15:49+00:00,LakersReporter,"LAL turned the ball over on its first two trips, but responded with a 9-0 run, capped by a fading jumper from @KingJames, as the Lakers take a 14-5 lead into the first time out in Charlotte.

Hornets are 2 for 6 with 3 TO's."
803,2023-01-02 21:11:51+00:00,LakersReporter,"No Lonnie Walker IV tonight in Charlotte due to the tailbone contusion that kept him out of LAL’s last game at Atlanta.

Austin Reaves started in his place in that win."
804,2022-12-31 03:56:24+00:00,LakersReporter,"Followed up with LeBron about telling Schröder that he was gonna score 40 prior to the game, and he said, scoring 30 hadn’t been working well enough to produce wins, so he figured he’d get 40."
805,2022-12-31 03:36:16+00:00,LakersReporter,"Walkoff 📺 with @KingJames after his 47 points on 18 of 27 FG’s, with 10 boards, 9 assists and 1 block as he led the Lakers to a 130-121 win at Atlanta after LAL had trailed by as many as 15 points. 👇🏻👇🏻"
806,2022-12-31 02:47:42+00:00,LakersReporter,"His 38th b-day, in Year 20, where only 11 NBA players have gotten, on the 3rd game in 4 nights, @KingJames has 45 points, 10 boards and 9 assists on 18 of 27 FG's.

LAL up 128-121 in the final minute."
807,2022-12-31 02:32:23+00:00,LakersReporter,"LeBron was 1 for 5 in the 1st Q, but he's 14 for 17 since."
808,2022-12-31 02:30:20+00:00,LakersReporter,"Now up to 37 points on 22 shots, @KingJames is 15 for 22, 3 of 4 from 3, and 4 of 6 at the FT line.

He's 11 of 15 in the paint, and 4 of 7 on outside jumpers.

LAL lead 108-105 after his latest triple."
809,2022-12-31 02:16:30+00:00,LakersReporter,"Even with a buzzer-beating tip from the Hawks, it was an impressive 3rd Q for the Lakers, who outscored the home team 36-28 to take a 98-95 lead into the 4th.

LeBron has 31 points, 9 boards and 8 assists on 13 of 20 FG's."
810,2022-12-31 02:07:55+00:00,LakersReporter,"The Lakers, all of a sudden, have the lead at 82-81, after a pair of hoops at the rim, from Gabriel and then LeBron.

James is up to 26-8-8 in 25 minutes, on 11 of 17 FG's. They've trailed by as many as 15."
