,Date,User,Tweet
1049,2022-12-02 22:38:24+00:00,LakersReporter,"Zeroing in on the 6-game trip that starts tonight, with a focus on the matchup in Milwaukee: 👇🏻👇🏻"
1050,2022-12-02 17:09:43+00:00,LakersReporter,One more: Lonnie Walker IV (left foot soreness) has been upgraded to probable.
1051,2022-12-02 17:06:44+00:00,LakersReporter,"Updates: 
- Troy Brown Jr. (left foot soreness) has been upgraded to available tonight against the Bucks.
- Dennis Schröder (personal reasons) has been downgraded to out."
1052,2022-12-01 22:08:51+00:00,LakersReporter,"Updated injury report:

- Troy Brown Jr. is probable (Left Foot Soreness) 
- Anthony Davis is probable (Low Back Tightness) 
- LeBron is probable (Left Adductor Strain) 
- Dennis Schröder is questionable (Personal Reasons) 
-Lonnie Walker IV is questionable (Left Foot Soreness)"
1053,2022-12-01 06:31:52+00:00,LakersReporter,Austin Reaves went for a season-high 22 points on just 10 FGA’s before talking to us on @SpectrumSN: 👇🏻👇🏻
1054,2022-12-01 05:30:03+00:00,LakersReporter,"Austin Reaves is up to 22 points, a season high, on just 10 field goal attempts, with 2 3's and 6 made FT's.

LAL lead 114-96 with 7:15 on the clock."
1055,2022-12-01 05:19:25+00:00,LakersReporter,"Russell Westbrook beat a quarter buzzer for the 2nd time tonight, this time from half court, to put the Lakers up 97-82. 

Seconds later, a fan drained the MGM Big Shot Jackpot from half court."
1056,2022-12-01 04:59:30+00:00,LakersReporter,"Fantastic offensive night from Austin Reaves, who's now 6 of 8 from the field after a pretty reverse layup, plus 6 of 8 at the FT line to lead LAL with 19 points.

Patrick Beverley added a transition 3 to put LAL up 78-68 early in the 3rd Q, forcing a POR time out."
1057,2022-12-01 04:37:20+00:00,LakersReporter,"LAL got a buzzer-beating 3 from Westbrook to allow a 66-62 halftime lead, just seconds after an incredible put-back dunk from POR rookie Shaedon Sharpe shook the building."
1058,2022-12-01 04:33:04+00:00,LakersReporter,"A look at Davis and T. Bryant playing at the same time here with 2 minutes left in the half. 

Bryant's been impactful off the bench, and on the 2nd offensive trip, AD went right over the top of Grant to score."
1059,2022-12-01 04:25:49+00:00,LakersReporter,"Justice Winslow hadn't hit more than 2 3's in any game this season, but starts 3 for 3 tonight against the Lakers. LAL had a similar opponent-shooting game when Detroit's Kylian Hayes started hot from 3 before cooling back to his average."
1060,2022-12-01 04:14:22+00:00,LakersReporter,"A strong 2nd Q shift from LeBron thus far, defending Grant on one end, and scoring 7 straight on the other, putting LAL up 35-27."
1061,2022-12-01 04:07:53+00:00,LakersReporter,"LAL recovered from a 17-6 deficit to take a 24-22 lead out of the 1st Q.

T. Bryant, who shot over 40% from 3 in consecutive years in Washington (on 2.0 attempts per game), hit his first 3 of the season (just his 2nd attempt in 6 games), and Gabriel added 2 FT's to close the 1st."
1062,2022-12-01 03:59:42+00:00,LakersReporter,"An 11-0 run boosted largely by Austin Reaves - who capped it with a steal and 2-handed dunk-  has the game tied at 17 after Portland opened with a 17-6 margin.

Blazers are severely shorthanded tonight, and their bench group has struggled to get anything on offense."
1063,2022-12-01 03:52:38+00:00,LakersReporter,"Portland is the 5th straight team the Lakers have played at home that is on the 2nd night of a back-to-back after playing the Clippers. The previous 4 were in this building, but last night's game was in Portland. 

LAL certainly haven't taken advantage early, as POR leads 17-6."
1064,2022-12-01 03:00:48+00:00,LakersReporter,"Starters: Schröder, Reaves, Beverley, LeBron and AD."
1065,2022-12-01 02:58:46+00:00,LakersReporter,Lonnie Walker IV is a late scratch for tonight’s game against Portland due to left foot soreness.
1066,2022-12-01 02:41:29+00:00,LakersReporter,Update: Brown Jr. is out.
1067,2022-12-01 02:05:19+00:00,LakersReporter,"Josh Hart is out tonight against the Lakers, per Chauncey Billups, after turning his ankle last night.

Damian Lillard remains out, and Nassir Little is also out tonight. 

Trendon Watford will start in Hart’s place."
1068,2022-12-01 01:55:28+00:00,LakersReporter,"Darvin Ham said Troy Brown Jr. tweaked his foot during a workout this morning, and remains questionable to play tonight. 

No word just yet on starters, with Brown Jr. iffy, Patrick Beverley coming off suspension, and Dennis Schröder having started in Beverley’s place."
1069,2022-11-30 19:41:47+00:00,LakersReporter,Troy Brown Jr. is now questionable to play tonight due to left foot soreness.
1070,2022-11-30 19:35:13+00:00,LakersReporter,"Lakers vs. Blazers, Three Things to Know:

https://t.co/JQRI4B8I9S"
1071,2022-11-30 01:03:14+00:00,LakersReporter,LeBron and AD are both probable to play tomorrow against Portland.
1072,2022-11-29 06:03:43+00:00,LakersReporter,"Final: Indy 116, LAL 115.

LAL were up 101-84 on Indiana with 9:59 to play, poised for a 6th win in 7 games before a collapse that ended on a buzzer-beating 3."
1073,2022-11-29 05:41:15+00:00,LakersReporter,"Quite a moment for 24-year-old Jaime Murry, who hits the first jackpot since Jan. 5, 2020."
1074,2022-11-29 05:32:42+00:00,LakersReporter,"Big LAL run to start the 4th pulls back the points they lost to close the 3rd, as Westbrook capped it off with a pretty lay off to Gabriel for a dunk.

It's 101-84 with 9:59 to play."
1075,2022-11-29 05:28:00+00:00,LakersReporter,"Less than ideal transition defense from the Lakers at the end of the 3rd Q was punished by Indy.

LAL led 92-76 with 59 seconds left in the 3rd, before allowing a pair of 3's, and a put-back layup at the buzzer, their lead now down to 9 at 93-84."
1076,2022-11-29 05:20:22+00:00,LakersReporter,"A block by Troy Brown Jr eventually led to a 3 on the other end by Kendrick Nunn off some nice ball movement, giving LAL their biggest lead of 12, late in the 3rd Q."
1077,2022-11-29 04:44:44+00:00,LakersReporter,"LAL rode Davis (18 points, 5 boards, 5 assists, 2 blocks on 7 of 8 FG's) and LeBron (14 points) to a 62-56 halftime lead, capped by a buzzer-beating corner 3 from Schröder."
1078,2022-11-29 04:38:49+00:00,LakersReporter,"Another impressive half thus far for Anthony Davis, who's 5 for 5 from the field towards 12 points, plus a team-best 5 assists (many coming out of Pacer traps) with 3 boards and 2 blocks."
1079,2022-11-29 04:19:39+00:00,LakersReporter,"LAL have been shooting free throws well of late, but not tonight. Four Lakers have already missed 1 (LeBron, AD, Schröder and Gabriel). Only Reaves is 2 for 2.

Team is 6 for 10, and Indy is 8 for 8."
1080,2022-11-29 04:12:00+00:00,LakersReporter,Good energy from both Wenyen Gabriel and Thomas Bryant off the LAL bench helped LAL take a 32-29 lead into the 2nd Q despite LeBron and AD sitting the final 3 minutes.
1081,2022-11-29 03:57:19+00:00,LakersReporter,"LeBron rolled his ankle a bit, stepping on Haliburton's foot ahead of a transition push for Indy. 

He'll sit at the 6:22 mark, close to his usual rest. Remains on the bench.

LAL lead 16-14."
1082,2022-11-29 03:45:20+00:00,LakersReporter,"LeBron has the first 7 points tonight, a game after he dropped 39 at San Antonio, as things get going against Indiana."
1083,2022-11-29 01:51:21+00:00,LakersReporter,"Darvin Ham expects both LeBron and AD to play (listed as “probable”) against Indiana.

He emphasized the importance of transition defense tonight after some slippage at San Antonio, with Indiana coming in 2nd in the NBA in fastbreak points (LAL are 4th)."
1084,2022-11-28 20:28:11+00:00,LakersReporter,Anthony Davis is probable for tonight’s game vs. Indy (upgraded from questionable) after missing the last game vs. SAS.
1085,2022-11-27 04:29:19+00:00,LakersReporter,Big night for @KingJames in San Antonio as he led LAL to a second straight win. Walkoff 📺 below: 👇🏻👇🏻
1086,2022-11-27 03:16:05+00:00,LakersReporter,"Big run-stopping 3 from Lonnie Walker IV, the former Spur, out of the time out as LeBron gets a rest."
1087,2022-11-27 03:14:38+00:00,LakersReporter,"A LeBron run (37 points after hitting his 7th 3) had LAL up 16 moments ago, but the Spurs ran their way to an 8-0 push to trim the margin in half with 7:11 still to play."
1088,2022-11-27 03:06:26+00:00,LakersReporter,"LeBron is now 6 for 10 from 3, and 10 for 10 at the FT line towards his 32 points.

LAL hold a 116-105 lead with 9:35 to play."
1089,2022-11-27 03:05:31+00:00,LakersReporter,"Russell Westbrook just returned to the bench and gave Darvin Ham a thumbs up that he's available to return. 

Laceration required no sutures."
1090,2022-11-27 02:56:00+00:00,LakersReporter,"Tonight has been LeBron's best 3-point shooting night of the season, at 5 for 9 thus far. 

He came in shooting just 24.0% from 3 in his first 11 games."
1091,2022-11-27 02:50:51+00:00,LakersReporter,"It's a flagrant two foul on Collins, who is ejected.

Westbrook got a technical foul for confronting Collins as he was getting up."
1092,2022-11-27 02:48:57+00:00,LakersReporter,"Zach Collins likely looking at a flagrant foul after a review for coming down hard on Westbrook's face, producing quite a lot of blood that LeBron tried to help stop by applying a towel as he pulled Russ away from Collins."
1093,2022-11-27 02:42:54+00:00,LakersReporter,"Austin Reaves is a perfect 5 for 5 off the bench after a transition and-1, for 12 bench points, his latest making it 97-90 LAL."
1094,2022-11-27 02:25:11+00:00,LakersReporter,"Dennis Schröder had only 24 combined points in his first 4 Laker games this season, albeit in limited minutes. 

Tonight he has 21 points already, on 6 of 8 FG's with 3 3's."
1095,2022-11-27 02:06:08+00:00,LakersReporter,Another Spurs injury: Jeremy Sochan (right quad contusion) is out as well.
1096,2022-11-27 02:04:16+00:00,LakersReporter,"That lob put LAL up 6, capping a run, before SAS managed the final 4 points of the half to make it a 70-68 margin. 

Lakers had trailed by 11 at the 7:24 mark before closing the half on a 29-16 run, much of it after Poeltl left the game.

Schröder and LeBron had 16 apiece."
1097,2022-11-27 02:01:47+00:00,LakersReporter,"Quite a play between LeBron and Westbrook...

LeBron lobbed it to Russ, who lobbed it right back to LeBron for a finish that put LAL up 70-66 late in the 2nd Q."
1098,2022-11-27 02:00:13+00:00,LakersReporter,Jakob Poeltl is out for the night due to right quad soreness.
1099,2022-11-27 01:43:31+00:00,LakersReporter,"Jakob Poeltl, who has taken advantage of AD's absence for 12 points and 9 rebounds already, just limped to the locker room after apparently hurting himself on a dunk."
1100,2022-11-27 01:33:57+00:00,LakersReporter,"Wenyen Gabriel stole a Spurs inbounds pass with 2 seconds left at midcourt, and rose to hit a one-legged, buzzer-beating 3, his 2nd of the quarter, to trim the SAS lead to 34-33 after 12 minutes."
1101,2022-11-27 01:28:04+00:00,LakersReporter,"A nice run from LAL's bench produced a 25-24 lead, after the starters had dug an 8-point hole moments earlier."
1102,2022-11-27 01:16:18+00:00,LakersReporter,"With no Anthony Davis patrolling inside, San Antonio has 12 points in the paint in the first 3+ minutes, including B2B layups to put them up 14-12 into the first Lakers time out."
1103,2022-11-27 01:14:40+00:00,LakersReporter,"LAL start out 4 for 4 with a pair of 3's, and SAS 5 of 8 with a pair of offensive boards in a fast start here in San Antonio. 

Lakers lead 12-10."
1104,2022-11-27 00:30:19+00:00,LakersReporter,"Starters at San Antonio on this B2B:

Dennis Schroder
Lonnie Walker IV
Troy Brown Jr.
LeBron James
Thomas Bryant"
1105,2022-11-26 23:33:45+00:00,LakersReporter,"Anthony Davis is out tonight with a left calf contusion that he suffered last night against San Antonio.

LeBron James officially a game-time decision, but plans to play."
1106,2022-11-26 19:43:54+00:00,LakersReporter,"Lakers at Spurs, Three Things to Know:

https://t.co/9WIVm98fnQ"
1107,2022-11-26 18:53:36+00:00,LakersReporter,"LeBron is probable for tonight’s game with the left adductor strain he came back from to play in last night’s game. He said afterwards that he expects to play tonight.

AD is questionable with a left calf contusion suffered vs. SAS last night. No longer on report w/back soreness."
1108,2022-11-26 18:13:22+00:00,LakersReporter,"The Lakers are back up to 6th in the NBA in defensive rating, with @AntDavis23 leading the way on that end."
1109,2022-11-26 03:59:12+00:00,LakersReporter,LeBron said there’s a “strong possibility” he plays tomorrow on the second night of a B2B. He feels good after rehabilitating for the previous two weeks.
1110,2022-11-26 03:58:27+00:00,LakersReporter,"LeBron said AD was playing like the best player in the league over the last several games when he was out. 

Davis took only 13 shots tonight, but went for 25 and 15 with four assists and three blocks."
1111,2022-11-26 03:42:24+00:00,LakersReporter,"Walkoff 📺 with @AntDavis23 as LAL improve to 6-11 behind his 25-13-3, with another game vs the Spurs tomorrow night. 👇🏻👇🏻"
1112,2022-11-26 02:57:52+00:00,LakersReporter,"Consecutive transition buckets from LeBron (17 points) restored LAL's cushion, at 90-78.

The second came on a nice behind-the-back lay off from Reaves, as LAL reached 22 fast break points on the evening."
1113,2022-11-26 02:44:00+00:00,LakersReporter,"The Lakers didn't score in the final 3:44 of the 3rd Q, as SAS ripped off an 8-0 run to trim the LAL lead to 4, with LeBron and AD on the bench.

LAL led by as many as 20 in the 1st half, before a 34-20 3rd Q for San Antonio nearly made it a new ball game."
1114,2022-11-26 02:02:27+00:00,LakersReporter,"LAL have pushed their lead to 20 at 59-39, with LeBron's fast break finish coming courtesy of Westbrook's 4th assist.
 
LeBron has 9 points on 4 of 8 FG's, with 3 assists and 6 TO's as he shakes off some rust after missing the last 5 games."
1115,2022-11-26 01:55:20+00:00,LakersReporter,Nice stretch of offense from both Austin Reaves (6 points) and Lonnie Walker IV (13 to lead all scorers) as LAL take a 51-37 lead into a 2nd Q time out at the 2:42 mark.
1116,2022-11-26 01:29:25+00:00,LakersReporter,"Russell Westbrook just tied Ron Harper for 24th on the NBA's all-time steals list with 1,716.

Up next? Metta World Peace, who's in our @SpectrumSN studio tonight, with 1,721. Then Magic Johnson with 1,724."
1117,2022-11-26 01:21:30+00:00,LakersReporter,"B2B 3's from former Spur Lonnie Walker IV to put LAL up 17-9. 

Lakers made only 4 triples at PHX on Tuesday night."
1118,2022-11-26 01:17:22+00:00,LakersReporter,"Strong start to the game in San Antonio for the Lakers, who take a 9-2 lead, with a pair of fast break finishes plus a LeBron J and Brown Jr. 3.

Spurs start 1 for 4 with 2 TO's."
1119,2022-11-26 00:30:24+00:00,LakersReporter,"Lakers starters:

Dennis Schroder
Lonnie Walker IV
Troy Brown Jr.
LeBron James
Anthony Davis"
1120,2022-11-25 23:55:10+00:00,LakersReporter,"After missing five games with a left adductor strain, LeBron James is available to play tonight."
1121,2022-11-25 23:31:20+00:00,LakersReporter,Juan Toscano-Anderson is available tonight after missing the last three with a sore back.
1122,2022-11-25 19:56:20+00:00,LakersReporter,"Lakers at Spurs, Three Things to Know:

https://t.co/n4RyWIafzR"
1123,2022-11-24 19:30:07+00:00,LakersReporter,Details of Patrick Beverley’s 3-game suspension below: https://t.co/jBumqMrk7s
1124,2022-11-23 05:43:04+00:00,LakersReporter,"Davis on his dominant stretch (last four):

“I don’t need any motivation. I go out here and play basketball. I think I finally just caught a rhythm … and also dealing with the back (had been an issue).”

He said his back feels really good now, and he’s able to play like himself."
1125,2022-11-23 05:37:05+00:00,LakersReporter,"Davis said he thinks it was a funny bone type thing in that first half collision with Booker, where he didn’t have much feeling in his left arm for a bit. It’s still a bit tingly, but clearly he was able to play through it and still dominate. Expects to be fine moving forward."
1126,2022-11-23 05:21:35+00:00,LakersReporter,"With AD's 5th block, a pack of Ayton, now it's just Bob McAdoo with the 30-20-5-5. 

It will come in a loss, with PHX up 115-105 with 43.7 seconds to play, as Davis continues his monstrous stretch for a 4th straight game: 37P, 21R, 5B, 5S, 2A, 11 of 17 FG, 15 of 16 FT's."
1127,2022-11-23 05:19:14+00:00,LakersReporter,"Davis is up to 83.1% from the FT line this season after going 15 of 16 tonight, up from a career-low 71.3% last season."
1128,2022-11-23 05:11:38+00:00,LakersReporter,"It ends up a 4-point possession for LAL with 2 Reaves FT's, then a Davis dunk. 

Lakers within 6."
1129,2022-11-23 05:11:10+00:00,LakersReporter,"Flagrant 1 on Booker for swiping down at Reaves' face, and Beverley ejected for his reaction.

After all that, LAL trail 106-98 with 3:55 to play after Reaves hit the pair of FT's. Lakers keep the ball."
1130,2022-11-23 05:04:45+00:00,LakersReporter,"Davis is the 4th player to have at least 30 and 20 with 5 steals and 4 blocks (Hakeem Olajuwon, Bob McAdoo and Kareem Abdul-Jabbar)."
1131,2022-11-23 05:03:33+00:00,LakersReporter,"A wide open transition 3 to cut the margin to 5 goes in and out for Walker IV. It's been that kind of night from 3 for LAL, who are now 4 of 20 (Suns are 15 for 31).

Walker IV did hit 2 FT's after a stop, so the deficit is 100-94 with 5:20 to play."
1132,2022-11-23 05:00:03+00:00,LakersReporter,"With a defensive rebound and transition layup, @AntDavis23 just joined Kareem Abdul-Jabbar to put up 30 points, 20 boards and 5 steals in a game.

It's AD's 7th 30-20 game in his career, and his 2nd as a Laker."
1133,2022-11-23 04:43:16+00:00,LakersReporter,"LAL got within 1 at the 1:28 mark of the 3rd Q, but allowed an 8-2 run to close the period, as PHX takes an 86-79 lead into the 4th.

Suns hit 2 more 3's to reach 15 on the evening, to just 4 from LAL.

Lakers have 36 paint points to PHX's 24."
1134,2022-11-23 04:34:36+00:00,LakersReporter,"After enveloping Booker on a drive to the rim, @AntDavis23 is up to 4 steals to go with his 3 blocks.

AD also has 24 points and 16 boards to lead the Lakers, who are within 2 at 75-73."
1135,2022-11-23 03:49:09+00:00,LakersReporter,Davis is staying in the game. Appears to be OK.
1136,2022-11-23 03:30:25+00:00,LakersReporter,"LAL played well defensively in the 1st Q, holding PHX to 43.5% FG's and forcing 5 TO's, but were inefficient on the other end, and trail 26-22 while shooting 40% from the field and going 0 for 5 from 3.

Davis had 7 points, 7 boards, 2 blocks, 2 assists and a steal."
1137,2022-11-22 17:14:27+00:00,LakersReporter,LeBron James is out tonight in Phoenix with the left adductor strain.
1138,2022-11-21 05:03:02+00:00,LakersReporter,"Austin Reaves - 21 points on only 11 shots - has been terrific of late. Walk off 📺 on @SpectrumSN.

“He’s been doing it all,” said Anthony Davis, who wasn’t bad himself (30 points, 18 boards, three steals)."
1139,2022-11-21 04:26:10+00:00,LakersReporter,"Last 3 games for @AntDavis23, all of which will be wins if LAL protect their 107-79 lead with 8:10 to play:

- 35.0 points on 61.7% FG's
- 17.3 rebounds
- 2.0 assists
- 1.7 blocks
- 1.3 steals 

BKN, DET and SAS all played small, and Davis punished them relentlessly inside."
1140,2022-11-21 04:20:15+00:00,LakersReporter,"Davis has had 6 career 30-20 games in his career, but he may fall 2 boards short tonight, as he goes to the bench with LAL up 99-74 and 9:40 to play.

Davis has 30 points on 12 of 19 shooting (10 of his 12 FG's in the paint), with 18 boards."
1141,2022-11-21 04:13:07+00:00,LakersReporter,"Anthony Davis is a +41 right now.

Has 28-17-3-2-1."
1142,2022-11-21 03:56:27+00:00,LakersReporter,"LAL hold a 74-48 lead after an 8-0 run to start the 3rd Q, at the 8:49 mark, forcing the 2nd time out already for Brett Brown, coaching tonight for Gregg Popovich (illness)."
1143,2022-11-21 03:32:21+00:00,LakersReporter,"Austin Reaves last 3 games:

vs. SAC: 19 points, 5 boards
vs. BKN: 15 points (3 of 4 3's)
vs. DET: 16 points, 6 assists

In the 1st half tonight vs. SAS, Reaves has 17 points (5 of 8 FG's,  3 of 4 3's, 4 of 4 FT's)"
1144,2022-11-21 03:25:02+00:00,LakersReporter,"Thomas Bryant made his season debut on Friday, and he's backing up a strong opening performance. with another tonight.

He's 4 for 4 towards 10 quick bench points."
1145,2022-11-21 03:04:37+00:00,LakersReporter,"San Antonio, especially without Poeltl's presence inside, really have little answer for an aggressive Anthony Davis.

AD's already up to 18 points (7 of 10 FG's) after 1 Q, plus 5 boards, 2 assists, 2 steals and 1 block to put LAL up 34-20."
1146,2022-11-21 02:01:37+00:00,LakersReporter,"Same starters as last game for the Lakers: Beverley, Reaves, Walker IV, Brown Jr. and Davis.

LeBron will miss his fourth straight game with the strained adductor."
1147,2022-11-19 22:50:26+00:00,LakersReporter,"LeBron James (left adductor strain) is questionable for Sunday’s game vs. San Antonio, the same listing he carried prior to Friday evening’s game.

Meanwhile, Juan Toscano-Anderson (mid-back soreness) is questionable."
1148,2022-11-19 06:47:44+00:00,LakersReporter,"Darvin Ham asked about the importance of Davis being this aggressive (37.5 ppg last two) when LeBron returns.

“Extremely … LeBron knows that we need Anthony to play like that. We (all) know we have to get AD going. That gives us our best chance to be successful.”"
1149,2022-11-19 06:25:43+00:00,LakersReporter,"Second straight dominant effort from @AntDavis23, who went for 38 points (10 of 16 FG’s, 18 of 21 FT’s), 16 boards,  4 blocks, 2 assists and 1 steal. Last game, he had 37 and 18.

Walkoff 📺 below:"
1150,2022-11-19 06:23:55+00:00,LakersReporter,"Austin Reaves on what appeared to be some lively bench discussion after he ran into the courtside fans and drinks spilled:

“I asked ‘Bron if that was his Lobos (tequila) over there.”

Reaves was big tonight, with 16 points on 8 shots, plus six assists without a turnover."
1151,2022-11-19 05:56:00+00:00,LakersReporter,"New season high in free throw attempts tonight for LAL, at 36, with 5 minutes to play.

They've made 31, for a healthy 86.1% rate.

AD's led the way, with 14 makes in 17 attempts."
1152,2022-11-19 05:47:37+00:00,LakersReporter,"Five-point possession for Detroit after an and-1 layup from Diallo turned into a flagrant foul on Bryant, giving the Pistons an extra possession they used for a Bogdanovic J.

Lakers lead down to 2."
1153,2022-11-19 05:40:23+00:00,LakersReporter,"Reaves had a mini stint where he looked like he did in the regular season finale at Denver last season, carrying the offense for three straight trips to score six points.

Reaves has LAL up 104-97 with 9:04 left."
1154,2022-11-19 05:32:43+00:00,LakersReporter,Important contributions from Wenyen Gabriel tonight: 5 for 5 from the field and the FT line for 15 points with 7 boards in 14 minutes.
1155,2022-11-19 05:28:57+00:00,LakersReporter,"LAL led 94-86 with 2:30 left in the 3rd quarter, before allowing a 9-2 run to close the period.

As such, they're up by just 1 with 12 minutes to play."
1156,2022-11-19 05:08:51+00:00,LakersReporter,"LAL's lead is 82-76 into a time out, with the second technical foul of the quarter on LAL (Beverley and Davis) coming up for Detroit.

Reaves and Beverley have B2B 3's as LAL remain hot at 59.2% from the field and 50% from 3."
1157,2022-11-19 04:44:04+00:00,LakersReporter,"With a big dunk in transition, and then a buzzer-beating 3, Lonnie Walker IV helped LAL leave the half with a 68-64 lead, despite trailing by 13 earlier in the half.

Davis had 16 points and 8 boards, and Westbrook had 10 assists."
1158,2022-11-19 04:42:52+00:00,LakersReporter,"Killian Hayes came into this game having made only 8 of 35 3's on the season (22.9%), after shooting 26% last season. Clearly an under on the scouting report.

Yet he's 3 for 3 from 3 tonight."
1159,2022-11-19 04:31:54+00:00,LakersReporter,"Nice bench lift from both Gabriel (7 points, 2 boards) and Bryant (8 points) with some bigger Lakers lineups after AD played the 1st Q as the lone big.

LAL cut a 13-point lead down to 3 with 4:15 to play in the 1st half."
1160,2022-11-19 04:22:01+00:00,LakersReporter,"Often times, having more rest is an advantage in the NBA. Pistons played last night, LAL haven't played since Sunday. 

That long a layoff seems to have LAL way out of rhythm, however, especially as they try to integrate two rotation players that have been hurt (Schroder/Bryant)."
1161,2022-11-19 04:13:31+00:00,LakersReporter,"LAL allowed 11 fast break points to Detroit, many coming off missed shots on Lakers drives, helping the Pistons - who shot 60.9% - take a 37-30 lead out of the 1st Q."
1162,2022-11-19 04:07:32+00:00,LakersReporter,"Three straight trips that LAL's guards drove directly into Pistons traffic and missed shots without getting the ball to Davis. 

Detroit scored in transition each time to go up 31-23.

Davis (1 FGA, 6 FTA's) got a touch on the next trip, and drew another Pistons foul."
1163,2022-11-19 04:04:49+00:00,LakersReporter,"Pistons are aggressively trapping Anthony Davis, which just got Troy Brown Jr. a wide open 3 that he hit to put LAL up 23-22.

Davis has also drawn several fouls, with four Pistons already with 2 PF's apiece (Bagley, Hayes, Duren and Noel)."
1164,2022-11-19 03:58:34+00:00,LakersReporter,"A benefit of having a rare 4-day stretch without a game, LAL had practice time to drill their zone defense, which they hadn't really utilized prior to this game. They've been in it the last few possessions."
